{
  "$schema": "http://json-schema.org/draft-07/schema#",
  "$comment": "GENERATED by gui/schema-gen/derive_nf_config_schemas.py from config/smsf.json + its source (ADR-0425). Do not edit; regenerate.",
  "title": "smsf",
  "type": "object",
  "additionalProperties": false,
  "properties": {
    "port": {
      "type": "integer",
      "x-cpp-type": "unsigned short"
    },
    "sbi_bind_address": {
      "type": "string",
      "x-cpp-type": "std::string"
    },
    "metrics_bind_address": {
      "type": "string",
      "x-cpp-type": "std::string"
    },
    "nrf_base_url": {
      "type": "string",
      "x-env-override": "SMSF_NRF_BASE_URL",
      "x-cpp-type": "std::string"
    },
    "self_base_url": {
      "type": "string"
    },
    "amf_base_url": {
      "type": "string",
      "x-env-override": "SMSF_AMF_BASE_URL",
      "x-cpp-type": "std::string"
    },
    "mo_sms": {
      "type": "object",
      "additionalProperties": false,
      "properties": {
        "no_iwmsc_rp_cause": {
          "type": "integer"
        },
        "no_iwmsc_tp_failure_cause": {
          "type": "integer"
        }
      }
    },
    "mt_sms": {
      "type": "object",
      "additionalProperties": false,
      "properties": {
        "tr1n_seconds": {
          "type": "integer"
        },
        "max_concurrent": {
          "type": "integer"
        }
      }
    },
    "li_poi": {
      "type": "object",
      "additionalProperties": false,
      "properties": {
        "enabled": {
          "type": "boolean"
        },
        "x1_bind_address": {
          "type": "string"
        },
        "x1_port": {
          "type": "integer"
        },
        "ne_identifier": {
          "type": "string"
        },
        "network_function_id": {
          "type": "string"
        },
        "interception_point_id": {
          "type": "string"
        },
        "mdf2_host": {
          "type": "string"
        },
        "mdf2_port": {
          "type": "integer"
        },
        "mdf2_sni": {
          "type": "string"
        },
        "x1_keepalive_p1_seconds": {
          "type": "integer"
        },
        "x1_keepalive_p2_seconds": {
          "type": "integer"
        },
        "x1_keepalive_p3_seconds": {
          "type": "integer"
        },
        "x1_allow_deactivate_all": {
          "type": "boolean"
        }
      }
    },
    "oauth2_required": {
      "type": "boolean",
      "x-env-override": "SMSF_OAUTH2_REQUIRED",
      "x-cpp-type": "bool"
    }
  },
  "required": [
    "amf_base_url",
    "metrics_bind_address",
    "nrf_base_url",
    "port",
    "sbi_bind_address"
  ],
  "x-config-file": "config/smsf.json",
  "x-source": [
    "nfs/smsf"
  ],
  "x-apply": "restart",
  "x-review": [
    "self_base_url: present in the file but no source line visibly reads it",
    "mo_sms: nested object shape inferred from current values (map-vs-struct meaning unverified; new keys refused until reviewed)",
    "mt_sms: nested object shape inferred from current values (map-vs-struct meaning unverified; new keys refused until reviewed)",
    "li_poi: nested object shape inferred from current values (map-vs-struct meaning unverified; new keys refused until reviewed)"
  ]
}
